### ISSUE TITLE
Proxy kills miner connection if no shares sent in 60sec

### ISSUE THREAD

**Issue by kim0** [xmrig/xmrig-proxy#117]
I am seeing this very consistent behavior where the proxy will close the connection to the miner if the miner is not able to send any shares after precisely 60-seconds. Here is an example

Every few minutes, I see the below in the log file
```
[2018-02-25 19:02:05] : SOCKET ERROR - [myproxy.com:9080] RECEIVE error: socket closed
```
I ran a network dump (tcpdump) to understand what is killing this connection. I got the below
```
19:01:05.191772 IP 10.0.0.9.40386 > 52.1.2.3.9080: Flags [P.], seq 18059:18279, ack 10542, win 396, options [nop,nop,TS val 3528273605 ecr 1455967476], length 220
19:01:05.291934 IP 52.1.2.3.9080 > 10.0.0.9.40386: Flags [P.], seq 10542:10605, ack 18279, win 231, options [nop,nop,TS val 1455970764 ecr 3528273605], length 63
19:01:05.292073 IP 10.0.0.9.40386 > 52.1.2.3.9080: Flags [.], ack 10605, win 396, options [nop,nop,TS val 3528273705 ecr 1455970764], length 0

19:02:05.291063 IP 52.1.2.3.9080 > 10.0.0.9.40386: Flags [F.], seq 10605, ack 18279, win 231, options [nop,nop,TS val 1456030765 ecr 3528273705], length 0
19:02:05.291612 IP 10.0.0.9.40386 > 52.1.2.3.9080: Flags [F.], seq 18279, ack 10606, win 396, options [nop,nop,TS val 3528333705 ecr 1456030765], length 0
19:02:05.389625 IP 52.1.2.3.9080 > 10.0.0.9.40386: Flags [.], ack 18280, win 231, options [nop,nop,TS val 1456030864 ecr 3528333705], length 0

19:02:34.588515 IP 10.0.0.9.43758 > 52.1.2.3.9080: Flags [S], seq 3012174852, win 29200, options [mss 1460,sackOK,TS val 3528363001 ecr 0,nop,wscale 7], length 0
```
A few things are interesting
* The first 3 lines are the last time the miner submitted a share to the proxy before its connection getting killed
* The second 3 lines start precisely after 60 seconds of last share
* The second 3 lines show that the proxy initiates closing the connection by sending a FIN packet
* The last line shows that the miner waits 30 sec before trying to re-establish the connection. Ofcourse this is wasted time that should have been used for mining. This is why I'd like to fix this problem
* It seems the 60-seconds is not a fixed number, but is related to the difficulty the proxy is setting on the miner. In my case, that miner difficulty was 2500. I think when I changed the difficulty, it changed the 60s number but I'm not sure. I can do some more testing if the devs need this

**Comment by xmrig** [comment]
Proxy has hard-coded 600s connection timeout interval, but no 60s interval and as I know in xmr-stak (by default) also no 60s timeouts.
Thank you.

**Comment by kim0** [comment]
Thanks, I understand the hardcoded value is 600s (not 60s). That's why I was thinking this is actually a bug :) As you can see from the network trace, the proxy is closing the connection. Let me know what else we can do to discover what's going wrong. Thanks

**Comment by kim0** [comment]
@xmrig .. Thanks, this issue stopped happening. Might have been a pool issue. Closing this issue.
